{"$schema":"https://json-schema.org/draft/2020-12/schema","type":"object","required":["published_at","model","rows","summary"],"properties":{"published_at":{"type":"string"},"model":{"type":"string"},"rows":{"type":"array","items":{"type":"object","required":["target_month","cutoff","release_date","badge","forecast_mom_pct","naive_mom_pct","actual_mom_pct","error_pp"]}},"summary":{"type":"object"}}}
