{
  "published_at": "2026-10-18T21:01:16Z",
  "model": "cpi_3m_vintage_true",
  "rows": [
    {
      "target_month": "2017-05",
      "cutoff": "2017-06-13",
      "release_date": "2017-06-14",
      "badge": "BT",
      "forecast_mom_pct": 0.23,
      "naive_mom_pct": 0.3,
      "actual_mom_pct": 0.09,
      "error_pp": 0.15
    },
    {
      "target_month": "2017-06",
      "cutoff": "2017-07-13",
      "release_date": "2017-07-14",
      "badge": "BT",
      "forecast_mom_pct": 0.15,
      "naive_mom_pct": 0.09,
      "actual_mom_pct": 0.09,
      "error_pp": 0.06
    },
    {
      "target_month": "2017-07",
      "cutoff": "2017-08-10",
      "release_date": "2017-08-11",
      "badge": "BT",
      "forecast_mom_pct": 0.16,
      "naive_mom_pct": 0.09,
      "actual_mom_pct": -0.07,
      "error_pp": 0.23
    },
    {
      "target_month": "2017-08",
      "cutoff": "2017-09-13",
      "release_date": "2017-09-14",
      "badge": "BT",
      "forecast_mom_pct": 0.04,
      "naive_mom_pct": -0.07,
      "actual_mom_pct": 0.3,
      "error_pp": -0.26
    },
    {
      "target_month": "2017-09",
      "cutoff": "2017-10-12",
      "release_date": "2017-10-13",
      "badge": "BT",
      "forecast_mom_pct": 0.11,
      "naive_mom_pct": 0.3,
      "actual_mom_pct": 0.53,
      "error_pp": -0.42
    },
    {
      "target_month": "2017-10",
      "cutoff": "2017-11-14",
      "release_date": "2017-11-15",
      "badge": "BT",
      "forecast_mom_pct": 0.25,
      "naive_mom_pct": 0.53,
      "actual_mom_pct": -0.06,
      "error_pp": 0.32
    },
    {
      "target_month": "2017-11",
      "cutoff": "2017-12-12",
      "release_date": "2017-12-13",
      "badge": "BT",
      "forecast_mom_pct": 0.26,
      "naive_mom_pct": -0.06,
      "actual_mom_pct": 0.0,
      "error_pp": 0.25
    },
    {
      "target_month": "2017-12",
      "cutoff": "2018-01-11",
      "release_date": "2018-01-12",
      "badge": "BT",
      "forecast_mom_pct": 0.16,
      "naive_mom_pct": 0.0,
      "actual_mom_pct": -0.06,
      "error_pp": 0.22
    },
    {
      "target_month": "2018-01",
      "cutoff": "2018-02-13",
      "release_date": "2018-02-14",
      "badge": "BT",
      "forecast_mom_pct": -0.04,
      "naive_mom_pct": -0.06,
      "actual_mom_pct": 0.54,
      "error_pp": -0.58
    },
    {
      "target_month": "2018-02",
      "cutoff": "2018-03-12",
      "release_date": "2018-03-13",
      "badge": "BT",
      "forecast_mom_pct": 0.16,
      "naive_mom_pct": 0.54,
      "actual_mom_pct": 0.45,
      "error_pp": -0.29
    },
    {
      "target_month": "2018-03",
      "cutoff": "2018-04-10",
      "release_date": "2018-04-11",
      "badge": "BT",
      "forecast_mom_pct": 0.31,
      "naive_mom_pct": 0.45,
      "actual_mom_pct": 0.23,
      "error_pp": 0.09
    },
    {
      "target_month": "2018-04",
      "cutoff": "2018-05-09",
      "release_date": "2018-05-10",
      "badge": "BT",
      "forecast_mom_pct": 0.41,
      "naive_mom_pct": 0.23,
      "actual_mom_pct": 0.4,
      "error_pp": 0.01
    },
    {
      "target_month": "2018-05",
      "cutoff": "2018-06-11",
      "release_date": "2018-06-12",
      "badge": "BT",
      "forecast_mom_pct": 0.36,
      "naive_mom_pct": 0.4,
      "actual_mom_pct": 0.42,
      "error_pp": -0.06
    },
    {
      "target_month": "2018-06",
      "cutoff": "2018-07-11",
      "release_date": "2018-07-12",
      "badge": "BT",
      "forecast_mom_pct": 0.35,
      "naive_mom_pct": 0.42,
      "actual_mom_pct": 0.16,
      "error_pp": 0.19
    },
    {
      "target_month": "2018-07",
      "cutoff": "2018-08-09",
      "release_date": "2018-08-10",
      "badge": "BT",
      "forecast_mom_pct": 0.32,
      "naive_mom_pct": 0.16,
      "actual_mom_pct": 0.01,
      "error_pp": 0.32
    },
    {
      "target_month": "2018-08",
      "cutoff": "2018-09-12",
      "release_date": "2018-09-13",
      "badge": "BT",
      "forecast_mom_pct": 0.19,
      "naive_mom_pct": 0.01,
      "actual_mom_pct": 0.06,
      "error_pp": 0.14
    },
    {
      "target_month": "2018-09",
      "cutoff": "2018-10-10",
      "release_date": "2018-10-11",
      "badge": "BT",
      "forecast_mom_pct": 0.07,
      "naive_mom_pct": 0.06,
      "actual_mom_pct": 0.12,
      "error_pp": -0.04
    },
    {
      "target_month": "2018-10",
      "cutoff": "2018-11-13",
      "release_date": "2018-11-14",
      "badge": "BT",
      "forecast_mom_pct": 0.06,
      "naive_mom_pct": 0.12,
      "actual_mom_pct": 0.18,
      "error_pp": -0.12
    },
    {
      "target_month": "2018-11",
      "cutoff": "2018-12-11",
      "release_date": "2018-12-12",
      "badge": "BT",
      "forecast_mom_pct": 0.12,
      "naive_mom_pct": 0.18,
      "actual_mom_pct": -0.33,
      "error_pp": 0.45
    },
    {
      "target_month": "2018-12",
      "cutoff": "2019-01-10",
      "release_date": "2019-01-11",
      "badge": "BT",
      "forecast_mom_pct": -0.01,
      "naive_mom_pct": -0.33,
      "actual_mom_pct": -0.32,
      "error_pp": 0.31
    },
    {
      "target_month": "2019-01",
      "cutoff": "2019-02-12",
      "release_date": "2019-02-13",
      "badge": "BT",
      "forecast_mom_pct": -0.16,
      "naive_mom_pct": -0.32,
      "actual_mom_pct": 0.19,
      "error_pp": -0.35
    },
    {
      "target_month": "2019-02",
      "cutoff": "2019-03-11",
      "release_date": "2019-03-12",
      "badge": "BT",
      "forecast_mom_pct": -0.15,
      "naive_mom_pct": 0.19,
      "actual_mom_pct": 0.42,
      "error_pp": -0.58
    },
    {
      "target_month": "2019-03",
      "cutoff": "2019-04-09",
      "release_date": "2019-04-10",
      "badge": "BT",
      "forecast_mom_pct": 0.1,
      "naive_mom_pct": 0.42,
      "actual_mom_pct": 0.56,
      "error_pp": -0.47
    },
    {
      "target_month": "2019-04",
      "cutoff": "2019-05-09",
      "release_date": "2019-05-10",
      "badge": "BT",
      "forecast_mom_pct": 0.39,
      "naive_mom_pct": 0.56,
      "actual_mom_pct": 0.53,
      "error_pp": -0.14
    },
    {
      "target_month": "2019-05",
      "cutoff": "2019-06-11",
      "release_date": "2019-06-12",
      "badge": "BT",
      "forecast_mom_pct": 0.51,
      "naive_mom_pct": 0.53,
      "actual_mom_pct": 0.21,
      "error_pp": 0.29
    },
    {
      "target_month": "2019-06",
      "cutoff": "2019-07-10",
      "release_date": "2019-07-11",
      "badge": "BT",
      "forecast_mom_pct": 0.44,
      "naive_mom_pct": 0.21,
      "actual_mom_pct": 0.02,
      "error_pp": 0.42
    },
    {
      "target_month": "2019-07",
      "cutoff": "2019-08-12",
      "release_date": "2019-08-13",
      "badge": "BT",
      "forecast_mom_pct": 0.25,
      "naive_mom_pct": 0.02,
      "actual_mom_pct": 0.17,
      "error_pp": 0.09
    },
    {
      "target_month": "2019-08",
      "cutoff": "2019-09-11",
      "release_date": "2019-09-12",
      "badge": "BT",
      "forecast_mom_pct": 0.13,
      "naive_mom_pct": 0.17,
      "actual_mom_pct": -0.01,
      "error_pp": 0.14
    },
    {
      "target_month": "2019-09",
      "cutoff": "2019-10-09",
      "release_date": "2019-10-10",
      "badge": "BT",
      "forecast_mom_pct": 0.06,
      "naive_mom_pct": -0.01,
      "actual_mom_pct": 0.08,
      "error_pp": -0.02
    },
    {
      "target_month": "2019-10",
      "cutoff": "2019-11-12",
      "release_date": "2019-11-13",
      "badge": "BT",
      "forecast_mom_pct": 0.08,
      "naive_mom_pct": 0.08,
      "actual_mom_pct": 0.23,
      "error_pp": -0.15
    },
    {
      "target_month": "2019-11",
      "cutoff": "2019-12-10",
      "release_date": "2019-12-11",
      "badge": "BT",
      "forecast_mom_pct": 0.1,
      "naive_mom_pct": 0.23,
      "actual_mom_pct": -0.05,
      "error_pp": 0.15
    },
    {
      "target_month": "2019-12",
      "cutoff": "2020-01-13",
      "release_date": "2020-01-14",
      "badge": "BT",
      "forecast_mom_pct": 0.08,
      "naive_mom_pct": -0.05,
      "actual_mom_pct": -0.09,
      "error_pp": 0.18
    },
    {
      "target_month": "2020-01",
      "cutoff": "2020-02-12",
      "release_date": "2020-02-13",
      "badge": "BT",
      "forecast_mom_pct": 0.03,
      "naive_mom_pct": -0.09,
      "actual_mom_pct": 0.39,
      "error_pp": -0.36
    },
    {
      "target_month": "2020-02",
      "cutoff": "2020-03-10",
      "release_date": "2020-03-11",
      "badge": "BT",
      "forecast_mom_pct": 0.08,
      "naive_mom_pct": 0.39,
      "actual_mom_pct": 0.27,
      "error_pp": -0.19
    },
    {
      "target_month": "2020-03",
      "cutoff": "2020-04-09",
      "release_date": "2020-04-10",
      "badge": "BT",
      "forecast_mom_pct": 0.19,
      "naive_mom_pct": 0.27,
      "actual_mom_pct": -0.22,
      "error_pp": 0.41
    },
    {
      "target_month": "2020-04",
      "cutoff": "2020-05-11",
      "release_date": "2020-05-12",
      "badge": "BT",
      "forecast_mom_pct": 0.15,
      "naive_mom_pct": -0.22,
      "actual_mom_pct": -0.67,
      "error_pp": 0.82
    },
    {
      "target_month": "2020-05",
      "cutoff": "2020-06-09",
      "release_date": "2020-06-10",
      "badge": "BT",
      "forecast_mom_pct": -0.2,
      "naive_mom_pct": -0.67,
      "actual_mom_pct": 0.0,
      "error_pp": -0.21
    },
    {
      "target_month": "2020-06",
      "cutoff": "2020-07-13",
      "release_date": "2020-07-14",
      "badge": "BT",
      "forecast_mom_pct": -0.29,
      "naive_mom_pct": 0.0,
      "actual_mom_pct": 0.55,
      "error_pp": -0.84
    },
    {
      "target_month": "2020-07",
      "cutoff": "2020-08-11",
      "release_date": "2020-08-12",
      "badge": "BT",
      "forecast_mom_pct": -0.04,
      "naive_mom_pct": 0.55,
      "actual_mom_pct": 0.51,
      "error_pp": -0.55
    },
    {
      "target_month": "2020-08",
      "cutoff": "2020-09-10",
      "release_date": "2020-09-11",
      "badge": "BT",
      "forecast_mom_pct": 0.35,
      "naive_mom_pct": 0.51,
      "actual_mom_pct": 0.32,
      "error_pp": 0.04